{
  "format": "nfai.exchange",
  "version": 2,
  "export": { "id": "export-v2-01", "createdAt": "2026-08-20T00:00:00Z", "origin": { "platform": "ANDROID", "appVersion": "0.3.0-test" }, "semanticHash": "aaeafcfbcfdf1d36ab4c8484e5d6d3537b6d4a60abc7216b3aa4fd702b1c0ef8", "sensitivity": "NORMAL" },
  "projects": [{ "id": "project-v2-01", "title": "Local project", "description": "Owner-fidelity fixture", "appearance": { "color": "FOREST", "icon": "FOLDER" }, "pinned": true, "archived": false, "createdAt": "2026-08-20T00:00:00Z", "updatedAt": "2026-08-20T00:00:00Z", "schemaVersion": 1, "instructionHistory": [{ "id": "instruction-v2-01", "revision": 1, "content": "Use only local notes", "source": "USER", "contentHash": "e178789b98639d7afa26abfa311c0de3a73cfda57f8e7fae2c952b84c49eccd6", "createdAt": "2026-08-20T00:00:00Z", "schemaVersion": 1 }] }],
  "conversations": [{ "id": "conversation-v2-01", "projectId": "project-v2-01", "title": "Local chat", "currentLeafId": "message-v2-01", "pinned": false, "archived": false, "revision": 1, "createdAt": "2026-08-20T00:00:00Z", "updatedAt": "2026-08-20T00:00:00Z", "autoTitlePending": false, "surface": "CHAT", "schemaVersion": 1, "settings": { "defaultProviderId": null, "defaultModelId": null, "harnessId": null, "harnessVersion": null, "contextPolicyVersion": 1, "memorySources": [{ "memoryId": "memory-v2-01", "sourceKind": "USER_CONFIRMED", "sourceVersion": 1 }], "schemaVersion": 1 }, "messages": [{ "id": "message-v2-01", "parentId": null, "ordinal": 0, "role": "user", "delivery": "COMPLETE", "revision": 1, "createdAt": "2026-08-20T00:00:00Z", "blocks": [{ "kind": "TEXT", "ordinal": 0, "text": "Fixture only" }] }] }],
  "knowledge": [{ "id": "knowledge-v2-01", "title": "Knowledge title", "body": "Knowledge body", "sourceEvidence": [{ "sourceType": "MANUAL_TEXT", "receivedAt": "2026-08-20T00:00:00Z", "contributedFields": ["title", "body"] }], "provenance": { "candidateId": "candidate-v2-01", "invocationId": "invocation-v2-01", "providerId": "MOCK", "modelId": "local.fixture", "harnessVersion": 1 }, "attachments": [{ "id": "asset-v2-01", "entry": "assets/aaaaaaaaaaaaaaaaaaaaaaaaaaaaaaaaaaaaaaaaaaaaaaaaaaaaaaaaaaaaaaaa", "mimeType": "text/plain", "displayName": "fixture.txt", "byteCount": 1, "sha256": "aaaaaaaaaaaaaaaaaaaaaaaaaaaaaaaaaaaaaaaaaaaaaaaaaaaaaaaaaaaaaaaa", "classification": "NORMAL" }], "status": "ACTIVE", "scope": "PROJECT", "projectId": "project-v2-01", "tags": ["fixture"], "contentHash": "9688bf3a0f04c7012a97f008b61f090d99010167587a8ecea30695790e4a8821", "createdAt": "2026-08-20T00:00:00Z", "updatedAt": "2026-08-20T00:00:00Z", "schemaVersion": 1, "history": [{ "id": "knowledge-revision-v2-01", "revision": 1, "title": "Knowledge title", "body": "Knowledge body", "status": "ACTIVE", "scope": "PROJECT", "projectId": "project-v2-01", "tags": ["fixture"], "contentHash": "9688bf3a0f04c7012a97f008b61f090d99010167587a8ecea30695790e4a8821", "createdAt": "2026-08-20T00:00:00Z" }] }],
  "memory": [{ "id": "memory-v2-01", "title": "Memory title", "body": "Memory body", "scope": "PROJECT", "scopeId": "project-v2-01", "source": "USER_CONFIRMED", "sourceStableId": "user-action", "sourceSummary": "Local confirmation", "status": "ACTIVE", "contentHash": "d72dfdc65fe0ed6c396b49ebac7c08f67f2d7e98918b3b7c4745417486cacda0", "conceptHash": "a48d7edeba20928d2823ede734a3bd44a941099bbb675bc6002c4c9580839319", "createdAt": "2026-08-20T00:00:00Z", "updatedAt": "2026-08-20T00:00:00Z", "lastConfirmedAt": "2026-08-20T00:00:00Z", "deletedAt": null, "schemaVersion": 1, "history": [{ "id": "memory-revision-v2-01", "revision": 1, "title": "Memory title", "body": "Memory body", "scope": "PROJECT", "scopeId": "project-v2-01", "source": "USER_CONFIRMED", "sourceStableId": "user-action", "sourceSummary": "Local confirmation", "status": "ACTIVE", "contentHash": "d72dfdc65fe0ed6c396b49ebac7c08f67f2d7e98918b3b7c4745417486cacda0", "createdAt": "2026-08-20T00:00:00Z", "schemaVersion": 1 }] }],
  "relations": [{ "id": "relation-v2-01", "type": "RELATED", "fromId": "knowledge-v2-01", "toId": "knowledge-v2-01", "scope": "PROJECT", "projectId": "project-v2-01", "status": "ACTIVE", "createdAt": "2026-08-20T00:00:00Z", "updatedAt": "2026-08-20T00:00:00Z", "createdByIntentId": "relation-intent-v2-01", "latestIntentId": "relation-intent-v2-01", "suggestionSource": "MANUAL", "history": [{ "id": "relation-revision-v2-01", "revision": 1, "action": "CONFIRM", "status": "ACTIVE", "intentId": "relation-intent-v2-01", "createdAt": "2026-08-20T00:00:00Z" }] }],
  "settings": { "uiLanguage": "en", "theme": "SYSTEM" }
}
